{"$schema":"https://json-schema.org/draft/2020-12/schema","$id":"myfuzz.compose-v5-manifest/v1","type":"object","additionalProperties":false,"required":["schema","name","sources","components","digest"],"properties":{"schema":{"const":"myfuzz.compose-v5-manifest/v1"},"name":{"type":"string","minLength":1},"sources":{"type":"array","minItems":1,"items":{"type":"object","additionalProperties":false,"required":["id","rtl_files","filelists"],"properties":{"id":{"type":"string","minLength":1},"rtl_files":{"type":"array","items":{"type":"string","minLength":1}},"filelists":{"type":"array","items":{"type":"string","minLength":1}}}}},"components":{"type":"array","minItems":4,"items":{"type":"object","additionalProperties":false,"required":["id","role","module","source_set","parameters"],"properties":{"id":{"type":"string","minLength":1},"role":{"enum":["cpu","ram","ip"]},"module":{"type":"string","minLength":1},"source_set":{"type":"string","minLength":1},"parameters":{"type":"object","additionalProperties":{"oneOf":[{"type":"integer"},{"type":"string"}]}}}}},"digest":{"type":"string","pattern":"^(|[0-9a-f]{64})$"}}}
